<?xml version="1.0" encoding="utf-8"?>
<config xmlns:xsi="http://www.w3.org/2001/XMLSchema-instance" xsi:noNamespaceSchemaLocation="urn:magento:module:BitTools_SkyHub:etc/skyhub.xsd">
    <skyhub>
        <catalog>
            <product>
                <attributes>
                    <attribute code="sku" enabled="true" required="true" editable="true">
                        <label>Product Sku</label>
                        <description>The product's main SKU (Stock Keeping Unit).</description>
                        <validation/>
                        <attribute_install_config>
                            <attribute_code>sku</attribute_code>
                            <label>SKU</label>
                            <backend_model>catalog/product_attribute_backend_sku</backend_model>
                            <type>static</type>
                            <input>text</input>
                            <source_model/>
                            <required>true</required>
                        </attribute_install_config>
                    </attribute>
                    <attribute code="name" enabled="true" required="true" editable="true">
                        <label>Product Name</label>
                        <description>The product's name.</description>
                        <validation/>
                        <attribute_install_config>
                            <attribute_code>name</attribute_code>
                            <label>Product Name</label>
                            <backend_model/>
                            <type>varchar</type>
                            <input>text</input>
                            <source_model/>
                            <required>true</required>
                        </attribute_install_config>
                    </attribute>
                    <attribute code="description" enabled="true" required="true" editable="true">
                        <label>Product Description</label>
                        <description>The product's description.</description>
                        <validation/>
                        <attribute_install_config>
                            <attribute_code>description</attribute_code>
                            <label>Product Description</label>
                            <backend_model/>
                            <type>varchar</type>
                            <input>text</input>
                            <source_model/>
                            <required>true</required>
                        </attribute_install_config>
                    </attribute>
                    <attribute code="status" enabled="true" cast_type="boolean" required="true" editable="true">
                        <label>Product Status</label>
                        <description>The product status that identifies if the product is enabled or disabled.</description>
                        <attribute_install_config>
                            <attribute_code>status</attribute_code>
                            <label>Product Status</label>
                            <backend_model/>
                            <type>int</type>
                            <input>select</input>
                            <source_model/>
                            <required>true</required>
                        </attribute_install_config>
                    </attribute>
                    <!--
                    <attribute code="qty" cast_type="float" type="varchar" input="text" enabled="false" required="false" editable="false">
                        <label>Product Stock Quantity</label>
                        <description>The products stock quantity available in store.</description>
                    </attribute>
                    -->
                    <attribute code="price" enabled="true" cast_type="float" required="true" editable="true">
                        <label>Product Price</label>
                        <description>The product's current price.</description>
                        <validation/>
                        <attribute_install_config>
                            <attribute_code>price</attribute_code>
                            <label>Product Price</label>
                            <backend_model/>
                            <type>decimal</type>
                            <input>text</input>
                            <source_model/>
                            <required>true</required>
                        </attribute_install_config>
                    </attribute>
                    <attribute code="promotional_price" enabled="true" required="true" cast_type="float" editable="true">
                        <label>Product Promotional Price</label>
                        <description>The product's current promotional price.</description>
                        <validation/>
                        <attribute_install_config>
                            <attribute_code>special_price</attribute_code>
                            <label>Product's promotional price.</label>
                            <backend_model/>
                            <type>decimal</type>
                            <input>text</input>
                            <source_model/>
                            <required>false</required>
                        </attribute_install_config>
                    </attribute>
                    <attribute code="cost" enabled="true" cast_type="float" required="true" editable="true">
                        <label>Product Cost</label>
                        <description>The product's cost.</description>
                        <validation/>
                        <attribute_install_config>
                            <attribute_code>cost</attribute_code>
                            <label>Product Cost</label>
                            <backend_model/>
                            <type>decimal</type>
                            <input>text</input>
                            <source_model/>
                            <required>false</required>
                        </attribute_install_config>
                    </attribute>
                    <attribute code="weight" enabled="true" cast_type="float" required="true" editable="true">
                        <label>Product Weight</label>
                        <description>The product's weight (in kilograms always).</description>
                        <validation/>
                        <attribute_install_config>
                            <attribute_code>weight</attribute_code>
                            <label>Product Weight</label>
                            <backend_model/>
                            <type>decimal</type>
                            <input>text</input>
                            <source_model/>
                            <required>true</required>
                        </attribute_install_config>
                    </attribute>
                    <attribute code="height" enabled="true" cast_type="float" required="true" editable="true">
                        <label>Product Height</label>
                        <description>The product's height (in centimeters always).</description>
                        <validation/>
                        <attribute_install_config>
                            <attribute_code>height</attribute_code>
                            <label>Product Height</label>
                            <backend_model/>
                            <type>decimal</type>
                            <input>text</input>
                            <source_model/>
                            <required>true</required>
                        </attribute_install_config>
                    </attribute>
                    <attribute code="width" enabled="true" cast_type="float" required="true" editable="true">
                        <label>Product Width</label>
                        <description>The product's width (in centimeters always).</description>
                        <validation/>
                        <attribute_install_config>
                            <attribute_code>width</attribute_code>
                            <label>Product Width</label>
                            <backend_model/>
                            <type>decimal</type>
                            <input>text</input>
                            <source_model/>
                            <required>true</required>
                        </attribute_install_config>
                    </attribute>
                    <attribute code="length" enabled="true" cast_type="float" required="true" editable="true">
                        <label>Product Length</label>
                        <description>The product's length (in centimeters always).</description>
                        <validation/>
                        <attribute_install_config>
                            <attribute_code>length</attribute_code>
                            <label>Product Length</label>
                            <backend_model/>
                            <type>decimal</type>
                            <input>text</input>
                            <source_model/>
                            <required>true</required>
                        </attribute_install_config>
                    </attribute>
                    <attribute code="brand" enabled="true" required="true" editable="true">
                        <label>Product Brand</label>
                        <description>The product's brand.</description>
                        <validation/>
                        <attribute_install_config>
                            <attribute_code>brand</attribute_code>
                            <label>Product Brand</label>
                            <backend_model/>
                            <type>int</type>
                            <input>select</input>
                            <source_model/>